{
  "schema_version": "1.0.0",
  "record_id": "ayk-ulku-dergisi",
  "record_path": "data/archive/catalog/ayk-ulku-dergisi.json",
  "record_snapshot_sha256": "dd64dbfc0af1b6dba80521fa59c700c547235d531cb7a252c3a5b491290c1e4b",
  "record_snapshot": {
    "title": "Ülkü Dergisi",
    "type": "publication",
    "date": {
      "start": "1933-02-05",
      "end": null,
      "precision": "day",
      "certainty": "exact",
      "display": "5 Şubat 1933",
      "note": "Tarih, Atatürk Ansiklopedisi maddesindeki olay tarihinden alınmıştır."
    },
    "source_institution": "Atatürk Ansiklopedisi (Atatürk Araştırma Merkezi)",
    "source_url": "https://www.ataturkansiklopedisi.gov.tr/detay/128/ulku-dergisi",
    "citation": "Betül KARCI, \"Ülkü Dergisi\", Atatürk Ansiklopedisi, Atatürk Araştırma Merkezi, erişim 23.10.2026, https://www.ataturkansiklopedisi.gov.tr/detay/128/ulku-dergisi.",
    "rights_status": "official_link_only"
  },
  "review_status": "pending",
  "reviewer": null,
  "review_date": null,
  "checks": {
    "historical_facts": "not_reviewed",
    "source_authenticity": "not_reviewed",
    "source_record_consistency": "not_reviewed",
    "quotation": "not_reviewed",
    "copyright_and_reuse": "not_reviewed"
  },
  "outcome": "pending",
  "evidence": [],
  "explanation": "",
  "publicationApproval": null
}
