{
  "schema_version": "1.0.0",
  "record_id": "atam-100-yilinda-lozan-baris-antlasmasi-2023",
  "record_path": "data/archive/catalog/atam-100-yilinda-lozan-baris-antlasmasi-2023.json",
  "record_snapshot_sha256": "87ace59ac17d1045908eeec410bc91426d4a6415a5d5598c66e78c13e382da00",
  "record_snapshot": {
    "title": "100. Yılında Lozan Barış Antlaşması",
    "type": "publication",
    "date": {
      "start": "2023-01-01",
      "end": null,
      "precision": "year",
      "certainty": "exact",
      "display": "2023",
      "note": "Basım yılı ATAM kitap künyesinden alınmıştır."
    },
    "source_institution": "Atatürk Araştırma Merkezi Yayınları",
    "source_url": "https://atam.gov.tr/kitaplar/100-yilinda-lozan-baris-antlasmasi/",
    "citation": "Sevtap Demirci (ed.), 100. Yılında Lozan Barış Antlaşması, Atatürk Araştırma Merkezi Yayınları, Ankara 2023, ISBN 978-975-17-5706-7, Yayın No. 556.",
    "rights_status": "official_link_only"
  },
  "review_status": "pending",
  "reviewer": null,
  "review_date": null,
  "checks": {
    "historical_facts": "not_reviewed",
    "source_authenticity": "not_reviewed",
    "source_record_consistency": "not_reviewed",
    "quotation": "not_reviewed",
    "copyright_and_reuse": "not_reviewed"
  },
  "outcome": "pending",
  "evidence": [],
  "explanation": "",
  "publicationApproval": null
}
