{
  "schema_version": "1.0.0",
  "record_id": "meclis-onunde-dua-1920",
  "record_path": "content/archive/records/meclis-onunde-dua-1920.json",
  "record_snapshot_sha256": "cbcd16feb21e564aecab7562db460f2c756991f28572f45cfd11b09076dd89e3",
  "record_snapshot": {
    "title": "Meclis Önünde Dua",
    "type": "photograph",
    "date": {
      "start": "1920-05-06",
      "end": null,
      "precision": "day",
      "certainty": "exact",
      "display": "6 Mayıs 1920"
    },
    "source_institution": "Türkiye Büyük Millet Meclisi",
    "source_url": "https://cdn.tbmm.gov.tr/KurtulusSavasiMuzeWeb/Fotograf/2.jpg",
    "citation": "Kurtuluş Savaşı Müzesi: Meclis Önünde Dua Fotoğrafı",
    "rights_status": "official_link_only"
  },
  "review_status": "pending",
  "reviewer": null,
  "review_date": null,
  "checks": {
    "historical_facts": "not_reviewed",
    "source_authenticity": "not_reviewed",
    "source_record_consistency": "not_reviewed",
    "quotation": "not_reviewed",
    "copyright_and_reuse": "not_reviewed"
  },
  "outcome": "pending",
  "evidence": [],
  "explanation": "",
  "publicationApproval": null
}
