{
  "schema_version": "1.0.0",
  "record_id": "milli-kutuphane-inonu-diyor-ki-1933",
  "record_path": "data/archive/catalog/milli-kutuphane-inonu-diyor-ki-1933.json",
  "record_snapshot_sha256": "c5757d66a3412f19204ca8f68ff90560210ad96e9da3406acf382ecb9d0cc85a",
  "record_snapshot": {
    "title": "İnönü Diyor Ki",
    "type": "publication",
    "date": {
      "start": "1933-01-01",
      "end": null,
      "precision": "year",
      "certainty": "estimated",
      "display": "1933",
      "note": "Katalog kaydında yayın tarihi alanı boş; yayın yılı yer numarasındaki yıl önekinden değerlendirildi."
    },
    "source_institution": "Millî Kütüphane",
    "source_url": "https://dijital-kutuphane.mkutup.gov.tr/tr/books/catalog/details/105276",
    "citation": "Millî Kütüphane Dijital Kütüphane, “İnönü Diyor Ki”, Yer No. 1933 AD 3595, erişim 23.10.2026, https://dijital-kutuphane.mkutup.gov.tr/tr/books/catalog/details/105276",
    "rights_status": "official_link_only"
  },
  "review_status": "pending",
  "reviewer": null,
  "review_date": null,
  "checks": {
    "historical_facts": "not_reviewed",
    "source_authenticity": "not_reviewed",
    "source_record_consistency": "not_reviewed",
    "quotation": "not_reviewed",
    "copyright_and_reuse": "not_reviewed"
  },
  "outcome": "pending",
  "evidence": [],
  "explanation": "",
  "publicationApproval": null
}
