{
  "schema_version": "1.0.0",
  "record_id": "ibb-erzincan-sapka-fotografi-1926",
  "record_path": "data/archive/catalog/ibb-erzincan-sapka-fotografi-1926.json",
  "record_snapshot_sha256": "f536b6c56e1aac6f85fdefd1229a8756847c9a84858492bffad50245f5d606f4",
  "record_snapshot": {
    "title": "Erzincan'da Şapka İnkılabı Üzerine Çekilen Grup Fotoğrafı",
    "type": "photograph",
    "date": {
      "start": "1926-01-01",
      "end": null,
      "precision": "year",
      "certainty": "exact",
      "display": "1926",
      "note": "Arşiv kaydında tarih [1926] olarak verilmiştir."
    },
    "source_institution": "İstanbul Büyükşehir Belediyesi Atatürk Kitaplığı",
    "source_url": "https://sayisalarsiv.ibb.gov.tr/yordambt/yordam.php?aDemirbas=Krt_014792",
    "citation": "İBB Atatürk Kitaplığı, Demirbaş No. Krt_014792, “Erzincan'da Şapka İnkılabı Üzerine Çekilen Grup Fotoğrafı”, erişim 23.10.2026, https://sayisalarsiv.ibb.gov.tr/yordambt/yordam.php?aDemirbas=Krt_014792",
    "rights_status": "official_link_only"
  },
  "review_status": "pending",
  "reviewer": null,
  "review_date": null,
  "checks": {
    "historical_facts": "not_reviewed",
    "source_authenticity": "not_reviewed",
    "source_record_consistency": "not_reviewed",
    "quotation": "not_reviewed",
    "copyright_and_reuse": "not_reviewed"
  },
  "outcome": "pending",
  "evidence": [],
  "explanation": "",
  "publicationApproval": null
}
