{
  "schema_version": "1.0.0",
  "record_id": "milli-kutuphane-ataturk-donemi-maliye-politikasi-1982",
  "record_path": "data/archive/catalog/milli-kutuphane-ataturk-donemi-maliye-politikasi-1982.json",
  "record_snapshot_sha256": "10d1605f071d13a89f1693bf868cc1815d156ae7a15af0adfd65b646b3565ea2",
  "record_snapshot": {
    "title": "Atatürk Dönemi Maliye Politikası",
    "type": "publication",
    "date": {
      "start": "1982-01-01",
      "end": null,
      "precision": "year",
      "certainty": "estimated",
      "display": "1982",
      "note": "Katalog kaydında yayın tarihi alanı boş; yayın yılı yer numarasındaki yıl önekinden değerlendirildi."
    },
    "source_institution": "Millî Kütüphane",
    "source_url": "https://dijital-kutuphane.mkutup.gov.tr/tr/books/catalog/details/136684",
    "citation": "Millî Kütüphane Dijital Kütüphane, “Atatürk Dönemi Maliye Politikası”, Yer No. 1982 AD 2826, erişim 23.10.2026, https://dijital-kutuphane.mkutup.gov.tr/tr/books/catalog/details/136684",
    "rights_status": "official_link_only"
  },
  "review_status": "pending",
  "reviewer": null,
  "review_date": null,
  "checks": {
    "historical_facts": "not_reviewed",
    "source_authenticity": "not_reviewed",
    "source_record_consistency": "not_reviewed",
    "quotation": "not_reviewed",
    "copyright_and_reuse": "not_reviewed"
  },
  "outcome": "pending",
  "evidence": [],
  "explanation": "",
  "publicationApproval": null
}
