{
  "schema_version": "1.0.0",
  "record_id": "ayk-bozkurt-lotus-davasi",
  "record_path": "data/archive/catalog/ayk-bozkurt-lotus-davasi.json",
  "record_snapshot_sha256": "0de4c12380d16cc3f2b7673138c581501e268b9111c7f1e4fef1988a755574ec",
  "record_snapshot": {
    "title": "Bozkurt - Lotus Davası",
    "type": "event",
    "date": {
      "start": "1926-08-02",
      "end": null,
      "precision": "day",
      "certainty": "exact",
      "display": "2 Ağustos 1926",
      "note": "Tarih, Atatürk Ansiklopedisi maddesindeki olay tarihinden alınmıştır."
    },
    "source_institution": "Atatürk Ansiklopedisi (Atatürk Araştırma Merkezi)",
    "source_url": "https://www.ataturkansiklopedisi.gov.tr/detay/4978/bozkurt-lotus-davasi",
    "citation": "Elçin YILMAZ, \"Bozkurt - Lotus Davası\", Atatürk Ansiklopedisi, Atatürk Araştırma Merkezi, erişim 23.10.2026, https://www.ataturkansiklopedisi.gov.tr/detay/4978/bozkurt-lotus-davasi.",
    "rights_status": "official_link_only"
  },
  "review_status": "pending",
  "reviewer": null,
  "review_date": null,
  "checks": {
    "historical_facts": "not_reviewed",
    "source_authenticity": "not_reviewed",
    "source_record_consistency": "not_reviewed",
    "quotation": "not_reviewed",
    "copyright_and_reuse": "not_reviewed"
  },
  "outcome": "pending",
  "evidence": [],
  "explanation": "",
  "publicationApproval": null
}
