{
  "schema_version": "1.0.0",
  "record_id": "cumhuriyetin-ilani-1923",
  "record_path": "content/archive/records/cumhuriyetin-ilani-1923.json",
  "record_snapshot_sha256": "8cfad1c2fec52fb0610385929415055628299181c13161190da1c390a63b03dd",
  "record_snapshot": {
    "title": "Cumhuriyet'in İlanı",
    "type": "event",
    "date": {
      "start": "1923-10-29",
      "end": null,
      "precision": "day",
      "certainty": "exact",
      "display": "29 Ekim 1923"
    },
    "source_institution": "Atatürk Ansiklopedisi (Atatürk Araştırma Merkezi)",
    "source_url": "https://ataturkansiklopedisi.gov.tr/detay/608/Cumhuriyet’in-İlanı",
    "citation": "Atatürk Ansiklopedisi: Cumhuriyet'in İlanı",
    "rights_status": "official_link_only"
  },
  "review_status": "pending",
  "reviewer": null,
  "review_date": null,
  "checks": {
    "historical_facts": "not_reviewed",
    "source_authenticity": "not_reviewed",
    "source_record_consistency": "not_reviewed",
    "quotation": "not_reviewed",
    "copyright_and_reuse": "not_reviewed"
  },
  "outcome": "pending",
  "evidence": [],
  "explanation": "",
  "publicationApproval": null
}
