{
  "schema_version": "1.0.0",
  "record_id": "menemen-olayi-1930",
  "record_path": "data/archive/catalog/menemen-olayi-1930.json",
  "record_snapshot_sha256": "91f3053e6f541f08fdf593452484ea35fc201449bda7be1e31281f14b636d028",
  "record_snapshot": {
    "title": "Menemen Olayı",
    "type": "event",
    "date": {
      "start": "1930-12-23",
      "end": null,
      "precision": "day",
      "certainty": "exact",
      "display": "23 Aralık 1930"
    },
    "source_institution": "Atatürk Ansiklopedisi (Atatürk Araştırma Merkezi)",
    "source_url": "https://www.ataturkansiklopedisi.gov.tr/detay/304/menemen-olayi-1930",
    "citation": "Atatürk Ansiklopedisi, “Menemen Olayı”, yazar Nasrullah Uzman, erişim 23.10.2026, https://www.ataturkansiklopedisi.gov.tr/detay/304/menemen-olayi-1930",
    "rights_status": "official_link_only"
  },
  "review_status": "pending",
  "reviewer": null,
  "review_date": null,
  "checks": {
    "historical_facts": "not_reviewed",
    "source_authenticity": "not_reviewed",
    "source_record_consistency": "not_reviewed",
    "quotation": "not_reviewed",
    "copyright_and_reuse": "not_reviewed"
  },
  "outcome": "pending",
  "evidence": [],
  "explanation": "",
  "publicationApproval": null
}
