{
  "schema_version": "1.0.0",
  "record_id": "atam-samsundan-erzuruma-mustafa-kemal-2024",
  "record_path": "data/archive/catalog/atam-samsundan-erzuruma-mustafa-kemal-2024.json",
  "record_snapshot_sha256": "74a56be6bb2a6a334c48f802f7fa795f38594d7e767a3efb803c8fcae843744d",
  "record_snapshot": {
    "title": "Samsun’dan Erzurum’a Mustafa Kemal",
    "type": "publication",
    "date": {
      "start": "2024-01-01",
      "end": null,
      "precision": "year",
      "certainty": "exact",
      "display": "2024",
      "note": "Basım yılı ATAM kitap künyesinden alınmıştır."
    },
    "source_institution": "Atatürk Araştırma Merkezi Yayınları",
    "source_url": "https://atam.gov.tr/kitaplar/samsundan-erzuruma-mustafa-kemal-2/",
    "citation": "Erdal Aydoğan, Samsun’dan Erzurum’a Mustafa Kemal, Atatürk Araştırma Merkezi Yayınları, Ankara 2024, ISBN 978-975-17-6039-5, Yayın No. 123.",
    "rights_status": "official_link_only"
  },
  "review_status": "pending",
  "reviewer": null,
  "review_date": null,
  "checks": {
    "historical_facts": "not_reviewed",
    "source_authenticity": "not_reviewed",
    "source_record_consistency": "not_reviewed",
    "quotation": "not_reviewed",
    "copyright_and_reuse": "not_reviewed"
  },
  "outcome": "pending",
  "evidence": [],
  "explanation": "",
  "publicationApproval": null
}
