{
  "schema_version": "1.0.0",
  "record_id": "cumhuriyetin-on-besinci-yil-kutlamalari-1938",
  "record_path": "data/archive/catalog/cumhuriyetin-on-besinci-yil-kutlamalari-1938.json",
  "record_snapshot_sha256": "873bad67db35836de516707f8b10cc54037b2b56b77e4bd0a51ef00bb50d04aa",
  "record_snapshot": {
    "title": "Cumhuriyet'in On Beşinci Yıl Kutlamaları",
    "type": "event",
    "date": {
      "start": "1938-10-29",
      "end": null,
      "precision": "day",
      "certainty": "exact",
      "display": "29 Ekim 1938"
    },
    "source_institution": "Atatürk Ansiklopedisi (Atatürk Araştırma Merkezi)",
    "source_url": "https://www.ataturkansiklopedisi.gov.tr/detay/611/cumhuriyetin-on-besinci-yil-kutlamalari-1938",
    "citation": "Atatürk Ansiklopedisi, “Cumhuriyet'in On Beşinci Yıl Kutlamaları”, yazar Cağfer Güler, erişim 23.10.2026, https://www.ataturkansiklopedisi.gov.tr/detay/611/cumhuriyetin-on-besinci-yil-kutlamalari-1938",
    "rights_status": "official_link_only"
  },
  "review_status": "pending",
  "reviewer": null,
  "review_date": null,
  "checks": {
    "historical_facts": "not_reviewed",
    "source_authenticity": "not_reviewed",
    "source_record_consistency": "not_reviewed",
    "quotation": "not_reviewed",
    "copyright_and_reuse": "not_reviewed"
  },
  "outcome": "pending",
  "evidence": [],
  "explanation": "",
  "publicationApproval": null
}
