{
  "schema_version": "1.0.0",
  "record_id": "ayk-hayat-mecmuasi-2-aralik-1926-mayis-1930",
  "record_path": "data/archive/catalog/ayk-hayat-mecmuasi-2-aralik-1926-mayis-1930.json",
  "record_snapshot_sha256": "6f7c852d05a7e66cf5c60f1dcefc4ca6752fbb94d49b4a51846d7ed530c3bafd",
  "record_snapshot": {
    "title": "Hayat Mecmuası (2 Aralık 1926- Mayıs 1930)",
    "type": "publication",
    "date": {
      "start": "1926-12-02",
      "end": "1930-05-31",
      "precision": "range",
      "certainty": "exact",
      "display": "2 Aralık 1926 - Mayıs 1930",
      "note": "Tarih aralığı, Atatürk Ansiklopedisi maddesindeki ifadeden alınmıştır."
    },
    "source_institution": "Atatürk Ansiklopedisi (Atatürk Araştırma Merkezi)",
    "source_url": "https://www.ataturkansiklopedisi.gov.tr/detay/1291/hayat-mecmuasi-2-aralik-1926-mayis-1930",
    "citation": "Emine Güntepe Yeşilbursa, \"Hayat Mecmuası (2 Aralık 1926- Mayıs 1930)\", Atatürk Ansiklopedisi, Atatürk Araştırma Merkezi, erişim 23.10.2026, https://www.ataturkansiklopedisi.gov.tr/detay/1291/hayat-mecmuasi-2-aralik-1926-mayis-1930.",
    "rights_status": "official_link_only"
  },
  "review_status": "pending",
  "reviewer": null,
  "review_date": null,
  "checks": {
    "historical_facts": "not_reviewed",
    "source_authenticity": "not_reviewed",
    "source_record_consistency": "not_reviewed",
    "quotation": "not_reviewed",
    "copyright_and_reuse": "not_reviewed"
  },
  "outcome": "pending",
  "evidence": [],
  "explanation": "",
  "publicationApproval": null
}
